[
  {
    "id": 18,
    "date_eu": "01.08.2022",
    "date_iso": "2022-08-01",
    "title": "neuer lieferant e-m-c",
    "category": "neue produkte",
    "teaser": "neuer lieferant e-m-c",
    "hero_image_url": null,
    "body_html": "neuer lieferant e-m-c\neine neue kategorie kam mit dem lieferannt e-m-c dazu. Nun waren wir auch in der lage werkzeuge und spezielle werkzeuge für die photovoltaik anbieten zu können. Dies stärkte das angebot in richtung der B2B schiene, gewerbetreibender und professioneller hobby handwerker die auf qualität in sachen werkzeug viel wert legen.",
    "author": null,
    "tags": "nan",
    "related_category_url": "E-M-C",
    "related_product_urls": null,
    "slug": "neuer-lieferant-e-m-c",
    "featured": true,
    "status": "published"
  },
  {
    "id": 17,
    "date_eu": "01.07.2022",
    "date_iso": "2022-07-01",
    "title": "neuer lieferant sintron",
    "category": "neue produkte",
    "teaser": "neuer lieferant sintron",
    "hero_image_url": null,
    "body_html": "neuer lieferant sintron\nmit dem lieferant sintron wurd die multimedia schiene gestärkt. Von bananenbuchsen über lüsterklemmen und sogar radios und verstärker war nun alles dabei. ",
    "author": "MCTRADE24 - Team",
    "tags": "bananenbuchse, lautsprecherkabel, lautsprecheranschluss, tivoli radio,",
    "related_category_url": "Sintron",
    "related_product_urls": null,
    "slug": "neuer-lieferant-sintron",
    "featured": true,
    "status": "published"
  },
  {
    "id": 16,
    "date_eu": "01.06.2022",
    "date_iso": "2022-06-01",
    "title": "neuer lieferant ETT",
    "category": "neue produkte",
    "teaser": "neuer lieferant ETT",
    "hero_image_url": null,
    "body_html": "neuer lieferant ETT\nett ist ein lieferant wie chilitec und somit konnten mit ett nun die auswahl an vielen tollen produkten erweitert werden. Ganz besonders die kategorien um haus und garten. Hier standen bewegungsmelder, schalterprogramme, kabel und sonstige ektrische produkte im vordergrund",
    "author": "MCTRADE24 - Team",
    "tags": "ett, schalterprogramm, schalter, steckdosen, bewegungsmelder, kabel, warnwesten",
    "related_category_url": "McPower",
    "related_product_urls": null,
    "slug": "neuer-lieferant-ett",
    "featured": true,
    "status": "published"
  },
  {
    "id": 14,
    "date_eu": "01.04.2022",
    "date_iso": "2022-04-01",
    "title": "neuer lieferant geocenter",
    "category": "neue produkte",
    "teaser": "neuer lieferant geocenter",
    "hero_image_url": null,
    "body_html": "neuer lieferant geocenter\num die freizeit und camping sparte noch ein wenig zu ergänzen, wurde mit dem lieferant geocenter ein toller partner in sachen bücher rund ums camping und reisen gewonnen. Ob landvergnügen, was wir selbst getestet haben, oder bücher über regionen oder städte, sowie stellplätze wurde angeboten.",
    "author": "MCTRADE24 - Team",
    "tags": "reiseführer, landvergnügen, taschenbuch camping, taschenbuch reise, taschen",
    "related_category_url": null,
    "related_product_urls": null,
    "slug": "neuer-lieferant-geocenter",
    "featured": true,
    "status": "published"
  },
  {
    "id": 13,
    "date_eu": "01.03.2022",
    "date_iso": "2022-03-01",
    "title": "neuer lieferant logilink",
    "category": "neue produkte",
    "teaser": "neuer lieferant logilink",
    "hero_image_url": null,
    "body_html": "neuer lieferant logilink\nein weiterer lieferant in sachen elktro konnte in den shop integriert werden. Ob powerbank, stromkabel, funksteckdosen, tastaturen und mäuse oder tv wandhalterungen. Alles war nun auch möglich bei uns zu bekommen.",
    "author": "MCTRADE24 - Team",
    "tags": "tv wandhalterung, funksteckdosen, stromkabel, netzwerkkable, tastatur, maus, tastatur maus set",
    "related_category_url": "2direct",
    "related_product_urls": null,
    "slug": "neuer-lieferant-logilink",
    "featured": true,
    "status": "published"
  },
  {
    "id": 11,
    "date_eu": "01.02.2022",
    "date_iso": "2022-02-01",
    "title": "neuer lieferant movera",
    "category": "neue produkte",
    "teaser": "neuer lieferant movera",
    "hero_image_url": null,
    "body_html": "neuer lieferant movera\nda wir selbst camper sind, war es uns ein bedürfniss auch was für die camperszene zu tun und somit suchten wir uns einen starken partner wie movera um auch die kategorie freizeit und camping ausbauen zu können. Von verbrauchsmaterialien wie toilettnflüssigkeit oder grauwasserzusatz bis zu besteck und elektrozubehör. gerade die kategorie elektrozubehör wurde damit nochmal gestärkt, da wir ja bereits von chilitec schon kabel im angebot hatten.",
    "author": "MCTRADE24 - Team",
    "tags": "movera, camping, abenteuer, reiselust, campervan, wohnmobil, toilettenzusatz, grauwasser zusatz, besteck, camping stühle",
    "related_category_url": "camping",
    "related_product_urls": null,
    "slug": "neuer-lieferant-movera",
    "featured": true,
    "status": "published"
  },
  {
    "id": 10,
    "date_eu": "01.01.2022",
    "date_iso": "2022-01-01",
    "title": "neuer lieferant reltech",
    "category": "neue produkte",
    "teaser": "neuer lieferant Reltech",
    "hero_image_url": null,
    "body_html": "neuer lieferant reltech\nmit reltech wurde das sortiment auf  schaltschrank, hutschiene, stromzähler, zeitschaltuhr oder auch relais und relais sockel erweitert. Auch normale mechanische gong, türklingeln in verschiedenen formen und klängen wurden in das sortiment aufgenommen.",
    "author": "MCTRADE24 - Team",
    "tags": "stromzähler, hutschiene, steckdose hutschiene, zeitschaltuhr hutschiene, zeitschaltuhr, relais, relais sockel",
    "related_category_url": "Reltech",
    "related_product_urls": null,
    "slug": "neuer-lieferant-reltech",
    "featured": true,
    "status": "published"
  },
  {
    "id": 8,
    "date_eu": "01.11.2021",
    "date_iso": "2021-11-01",
    "title": "neuer lieferant star trading",
    "category": "neue produkte",
    "teaser": "neuer lieferant star trading",
    "hero_image_url": "https://mctrade24.com/mediafiles/Bilder/led_kerzen_uebersicht.png",
    "body_html": "neuer lieferant star trading\nmit dem lieferante star trading steigen wir in den dekobereich ein. Von led-kerzen, led-beleuchtung, grableuchten und tolle lampen für den garten bis zu strom adaptern um die kerzen von batterien unabhängig zu betreiben. Nun waren wir nicht mehr nur ein shop der eher männer ansprach sondern auch für frauen genug zu bieten hat",
    "author": "MCTRADE24 - Team",
    "tags": "star trading, led-kerzen, led-stabkerzen, led-stumpenkerzen, solar lichter, grableuchte, strom adapter",
    "related_category_url": "Star-Trading",
    "related_product_urls": null,
    "slug": "neuer-lieferant-star-trading",
    "featured": true,
    "status": "published"
  },
  {
    "id": 6,
    "date_eu": "01.09.2021",
    "date_iso": "2021-09-01",
    "title": "Erweiterung der Produkte auf Schalterprogramme Milos und Delphi",
    "category": "neue produkte",
    "teaser": "Milos und delphi eingeführt",
    "hero_image_url": "https://mctrade24.com/mediafiles/Bilder/MILOSSteckdosenSchalterKomplettset94.jpg",
    "body_html": "Milos und delphi ins sortiment aufgenommen\nmit den serien milos und delphi, welche in weiß, silber und anthrazit erhältlich sind, machten wir einen großen sprung in noch mehr produktvielfalt. Ab sofort  konnten wir für häuslebauer schalter und steckdosen zu super preisen anbieten",
    "author": "MCTRADE24 - Team",
    "tags": "milos, delphi, milos anthrazit, milos weiß, delphi silber, delphi weiß, steckdosen, schalter, kreuzschalter, wecheslschalter",
    "related_category_url": "schalterprogramme",
    "related_product_urls": null,
    "slug": "erweiterung-der-produkte-auf-schalterprogramme-milos-und-delphi",
    "featured": true,
    "status": "published"
  },
  {
    "id": 1,
    "date_eu": "01.10.2020",
    "date_iso": "2020-10-01",
    "title": "Gründung des Onlineshops MCTRADE24.",
    "category": "allgemein",
    "teaser": "Start des onlinehandels mit einem kleinen Wordpress shop und auf ebay",
    "hero_image_url": null,
    "body_html": "Start des onlinehandels.\nDadurch dass ich funkschalter und sender sowie bewegungsmelder mit funk gebraucht habe, und so überzeugt von den tollen produkten von chilitec war, habe ich mit dem hersteller/lieferanten in verbindung gesetzt. Daraus entstand die idee dies sachen selbst zu verkaufen. also habe ich bei ebay die produkte eingestellt. schnell war klar auch für kunden diese sachen direkt anzubieten und diese dann günstiger mit gutem service in einem eigenen onlineshop anzubieten. denn hier haben wir nur die paypal gebühren und konnten 10% günstiger als bei ebay anbieten.",
    "author": "MCTRADE24 - Team",
    "tags": "chilitec, pilota casa, funksender, funkempfänger, funk bewegungsmelder, funksteckdosen mit fernbedienung",
    "related_category_url": "pilota-casa-porta",
    "related_product_urls": ", chilitic-pilota-casa-funksteckdosen-set-5x-steckdose-2x-fb, funk-bewegungsmelder-fur-pilota-casa-funk-22757, chili-tec-pilota-casa-funksteckdosen-set-3x-steckdosen-1x-fernbedienung",
    "slug": "gründung-des-onlineshops-mctrade24",
    "featured": true,
    "status": "published"
  },
  {
    "id": 15,
    "date_eu": "01.05.2022",
    "date_iso": "2022-05-01",
    "title": "umzug ins neue lager",
    "category": "allgemein",
    "teaser": "umzug ins neue lager",
    "hero_image_url": null,
    "body_html": "umzug ins neu lager\ndurch den gewinn vieler weiterer lieferanten platzte das lager im obergeschoß unseres hauses aus allen nähten und es war auch sehr erschwerlich die sachen erst alle hoch und dann bei auslieferung wieder alle runter zu bekommen. Daher wurde ein lager ebenerdig angelegt, was mit einer höhe von bis zu 3,6 m auch das lagern für nachrückartikel erleichterte. auch unser versandienstleister freuts sich, denn ab sofort konnten die pakete auf rollwagen abgeholt werden und mussten nicht mehr einzeln in den wagen gepackt werden. zeitgleich haben wir von billbee auf JTL Wawi umgestellt, da wir nun auch eine bessere lagerungsstrategie fahren konnten. ebenso wurde durch jtl auch das einstellen in den shop und auf die plattformen erleichtert, was uns noch mehr zeit gab um andere dinge zu tun, wie noch mehr lieferanten für unsere kunden zu finden und das angebot an artikeln auszubauen. mit dem jtl-shop bekam unser onlineshop ebenfalls nochmals einen bosst und eine wunderschöne verwandlung. nun war es für die kunden deutlich komfortabler zu shoppen",
    "author": "MCTRADE24 - Team",
    "tags": "neues lager, jtl-wawi, jtl-shop",
    "related_category_url": null,
    "related_product_urls": null,
    "slug": "umzug-ins-neue-lager",
    "featured": false,
    "status": "published"
  },
  {
    "id": 9,
    "date_eu": "01.12.2021",
    "date_iso": "2021-12-01",
    "title": "neuer lieferant LEDmaxx",
    "category": "neue produkte",
    "teaser": "neuer lieferant LEDmaxx",
    "hero_image_url": null,
    "body_html": "neuer lieferant LEDmaxx\nmit dem neuen lieferant LEDmaxx konnten wir nun unsere kategorie beleuchtung ausbauen, von glühbirnen in verschiedenen farben über led in verschiedenen farben war auch die ausergewöhnlichsten formen dabei. Auch boden einbaustrahler die wir mit chilitec schon anbieten konnten waren nun mit einer noch größeren vielfalt vorhanden. die adpater für e27 auf e14 oder umgedreht sowie von anderen formaten auf ghleiche oder wieder anderen formate waren nun kein problem mehr. ",
    "author": "MCTRADE24 - Team",
    "tags": "adapter e27 auf e27, g9, e14, e40 b22, farbige led lampen, baufassung,",
    "related_category_url": "LEDmaxx",
    "related_product_urls": null,
    "slug": "neuer-lieferant-ledmaxx",
    "featured": false,
    "status": "published"
  },
  {
    "id": 7,
    "date_eu": "01.10.2021",
    "date_iso": "2021-10-01",
    "title": "neuer lieferant REV",
    "category": "neue produkte",
    "teaser": "Neuer Lieferant REV",
    "hero_image_url": null,
    "body_html": "Neuer Lieferant REV\nmit dem lieferanten rev haben wir nun noch mehr auswahl in sachen alles aus dem baumarkt im sortiment. Nun konnten wir steckdosenleisten, funk gongs und vieles mehr was kunden auch im baumarkt bekommen können anbieten. Und all das konnten wir unseren kunden bis nach hause liefern.",
    "author": "MCTRADE24 - Team",
    "tags": "rev, mehrfachsteckdosen, funk gong, messgerät, fehlerschutz stromadapter",
    "related_category_url": "search/?qs=rev",
    "related_product_urls": null,
    "slug": "neuer-lieferant-rev",
    "featured": false,
    "status": "published"
  },
  {
    "id": 5,
    "date_eu": "01.05.2021",
    "date_iso": "2021-05-01",
    "title": "Warenwirtschaft eingeführt",
    "category": "allgemein",
    "teaser": "billbee als Warenwirtschaft eingeführt",
    "hero_image_url": null,
    "body_html": "billbee als warenwirtschaft \nda die verkäufe immer mehr wurden und auch die anzahl und vielfalt der produkte, sowie sets aus mehreren einzelprodukten, musste nun statt einer excel liste ein warenwirtschaftssystem eingeführt werden. Dies hat die fehlerquote auf 0 gesenkt und die zeiten der kommissionierung verringert. in diesem zuge zogen wir aus dem einem raum in das komplette obergeschoss in unserem wohnhaus um und lagerten nun alles in mehreren regalen.",
    "author": "MCTRADE24 - Team",
    "tags": "nan",
    "related_category_url": null,
    "related_product_urls": null,
    "slug": "warenwirtschaft-eingeführt",
    "featured": false,
    "status": "published"
  },
  {
    "id": 4,
    "date_eu": "01.04.2021",
    "date_iso": "2021-04-01",
    "title": "Neue Verkaufsplattform: kaufland",
    "category": "allgemein",
    "teaser": "kaufland als neue verkaufsplattform dazu genommen",
    "hero_image_url": null,
    "body_html": "kaufland als neue möglichkeit\num noch mehr leute zu erreichen wurde kaufland als neue verkaufsplattform dazu genommen",
    "author": "MCTRADE24 - Team",
    "tags": "nan",
    "related_category_url": null,
    "related_product_urls": null,
    "slug": "neue-verkaufsplattform-kaufland",
    "featured": false,
    "status": "published"
  },
  {
    "id": 12,
    "date_eu": "15.03.2021",
    "date_iso": "2021-03-15",
    "title": "das ende von prowin",
    "category": "allgemein",
    "teaser": "prowin musste entfernt werden",
    "hero_image_url": null,
    "body_html": "prowin musste entfernt werden\nviele unserer kunden bedauern den ausstieg bei prowin und den angeboten auf unserer seite, weil prowin einen solchen vertrieb nicht möchte. Daher mussten wir unter androhung gesperrt zu werden die produkte bei uns entfernen. allerdings haben unsere kunden weitehin die möglichkeit über den prowin direktshop bei uns zu bestellen. diesen kann man unter: https://vp.prowin-shop.net/index.php?referenceKey=m.deja erreichen. natürlich versuchen wir auch darüber unseren service genauso gut umzusetzen wie bisher.",
    "author": "MCTRADE24 - Team",
    "tags": "prowin, prowin vertrieb, prowin produkte",
    "related_category_url": null,
    "related_product_urls": null,
    "slug": "das-ende-von-prowin",
    "featured": false,
    "status": "published"
  },
  {
    "id": 3,
    "date_eu": "01.02.2021",
    "date_iso": "2021-02-01",
    "title": "Neue Verkaufsplattform: amazon",
    "category": "allgemein",
    "teaser": "amazon als neue verkaufsplattform dazu genommen",
    "hero_image_url": null,
    "body_html": "Amazon als neue möglichkeit\num noch mehr leute zu erreichen wurde amazon als neue verkaufsplattform dazu genommen",
    "author": "MCTRADE24 - Team",
    "tags": "nan",
    "related_category_url": null,
    "related_product_urls": null,
    "slug": "neue-verkaufsplattform-amazon",
    "featured": false,
    "status": "published"
  },
  {
    "id": 2,
    "date_eu": "01.11.2020",
    "date_iso": "2020-11-01",
    "title": "Prowin Produkte",
    "category": "allgemein",
    "teaser": "Produkte von Prowin im angebot",
    "hero_image_url": null,
    "body_html": "Ebenso wie chilitec, begeisterte mich alles von prowin, daher nahm ich alles von prowin in meinen onlineshop und bei ebay auf. Egal ob backofenreiniger, alleskönner, oder die perfekten tücher. Die herzförmigen toilettenbürsten waren auch eine tolle sache, das sich dort kein dreck mehr in den bürsten absetzten kann und damit war auch ein schlechter geruch kein thema mehr.",
    "author": "MCTRADE24 - Team",
    "tags": "prowin alleskönner, prowin backofenreiniger",
    "related_category_url": null,
    "related_product_urls": null,
    "slug": "prowin-produkte",
    "featured": false,
    "status": "published"
  }
]